{
    "$schema": "../schemas/config.schema.json",
    "http": {
        "port": 9000
    },
    "logger": {
        "level": "debug",
        "logFilePath": ".runtime/logs/ss-ai.log",
        "includeSourceLocation": true,
        "includeStackTrace": false
    },
    "runtimeFiles": {
        "tempDir": ".runtime/temp",
        "userDataDir": ".runtime/user-data"
    },
    "auth": {
        "mode": "local-password",
        "cookieSecure": false
    },
    "promptLog": {
        "enabled": true,
        "filePath": ".runtime/logs/ss-ai.prompt.log"
    }
}