{
    "$schema": "../schemas/config.schema.json",
    "http": {
        "host": "0.0.0.0",
        "port": 8999
    },
    "logger": {
        "level": "info",
        "logFilePath": ".runtime/logs/ss-ai.log",
        "clearLogFileOnStart": false,
        "includeSourceLocation": true,
        "includeStackTrace": false
    },
    "runtimeFiles": {
        "tempDir": ".runtime/temp",
        "userDataDir": ".runtime/user-data"
    },
    "agent": {
        "timeoutMs": 30000,
        "maxRetries": 2
    },
    "promptLog": {
        "enabled": true,
        "filePath": ".runtime/logs/ss-ai.prompt.log"
    },
    "auth": {
        "mode": "default-user",
        "defaultUserId": "default",
        "allowRegistration": true,
        "sessionDays": 30,
        "cookieName": "ss_ai_session",
        "cookieSecure": false
    },
    "models": {
        "mistral.ai": {
            "apiUrl": "https://api.mistral.ai",
            "availableModels": [
                "mistral-large-latest",
                "mistral-medium-latest",
                "mistral-small-latest",
                "ministral-3b-latest",
                "ministral-8b-latest",
                "ministral-14b-latest",
                "magistral-small-latest",
                "open-mistral-nemo-2407"
            ]
        }
    }
}
