{
    "$schema": "../schemas/config.schema.json",
    "logger": {
        "level": "info",
        "logFilePath": "runtime/logs/ss-ai.log",
        "includeSourceLocation": false,
        "includeStackTrace": false
    },
    "runtimeFiles": {
        "tempDir": "runtime/temp",
        "userDataDir": "runtime/user-data"
    },
    "auth": {
        "mode": "local-password",
        "cookieSecure": false
    },
    "promptLog": {
        "enabled": false,
        "filePath": "runtime/logs/ss-ai.prompt.log"
    }
}